{
  "retrieval_request_id": "d9be83ed-9e66-54d8-83e7-b6ba1f5eba72",
  "knowledge_base_version_id": "fd400183-2242-50aa-8b83-d670c1ce5a1f",
  "query_text": "为学习者C：负责企业知识平台架构检索提示注入、不可信文档与知识库安全的专业证据与实操内容",
  "top_k": 4,
  "filters": {
    "knowledge_node_ids": [
      "RAG-M05-N04",
      "RAG-M07-N03"
    ],
    "max_difficulty_level": 5
  }
}
